{
  "schema_version": "9.0",
  "artifact_type": "kristal_logical_artifact",
  "artifact_id": "urn:kristal:workload:formula",
  "logical_contract": {
    "id": "workload.formula-ir",
    "version": "1.0"
  },
  "payload": {
    "root": {
      "kind": "relation",
      "op": "=",
      "args": [
        {
          "kind": "symbol",
          "id": "pi"
        },
        {
          "kind": "literal",
          "value": "3.1415926535"
        }
      ]
    }
  },
  "logical_commitment": {
    "profile": "kristal.logical/jcs-sha256-v1",
    "digest": "sha256:832882cbffc19f3f8a6ae43b8c1c61130d5cf7a65128e3b5d7970a8de56163f4"
  },
  "scope": {
    "workload": "polymorphic-reference"
  }
}
