{
  "schema_version": "9.0",
  "artifact_type": "kristal_logical_artifact",
  "artifact_id": "urn:kristal:workload:relation",
  "logical_contract": {
    "id": "workload.relation",
    "version": "1.0"
  },
  "payload": {
    "shared_envelope": {
      "record_role": "reference_knowledge",
      "source": "src:example"
    },
    "columns": [
      "subject",
      "object",
      "version_group"
    ],
    "rows": [
      [
        "entity:1",
        "move:33",
        "vg:1"
      ],
      [
        "entity:1",
        "move:45",
        "vg:1"
      ]
    ]
  },
  "logical_commitment": {
    "profile": "kristal.logical/jcs-sha256-v1",
    "digest": "sha256:afd611a56ee197da8d94cb1f36c3e4be7f16a65d0cb6022ed816c815cdceb413"
  },
  "scope": {
    "workload": "polymorphic-reference"
  }
}
