{
  "schema_version": "9.0",
  "artifact_type": "kristal_logical_artifact",
  "artifact_id": "urn:kristal:example:recipe:carbonara",
  "logical_contract": {
    "id": "example.recipe-procedure",
    "version": "1.0"
  },
  "payload": {
    "steps": [
      {
        "id": "s1",
        "action": "boil_water"
      },
      {
        "id": "s2",
        "action": "cook_pasta",
        "after": [
          "s1"
        ]
      }
    ]
  },
  "logical_commitment": {
    "profile": "kristal.logical/jcs-sha256-v1",
    "digest": "sha256:5118cf41de4624644f06f6d5e15340b3b3aa88c93f12ce68eee2cb6d02479be5"
  },
  "scope": {
    "domain": "culinary"
  },
  "authority_ref": "urn:kristal:authority:example"
}
