{
  "schema_version": "9.0",
  "artifact_type": "kristal_logical_artifact",
  "artifact_id": "urn:kristal:workload:epistemic",
  "logical_contract": {
    "id": "workload.epistemic-corpus",
    "version": "1.0"
  },
  "payload": {
    "claims": [
      {
        "id": "c1",
        "layer": "mechanical",
        "text": "measured relation"
      },
      {
        "id": "c2",
        "layer": "interpretive",
        "text": "interpretation",
        "depends_on": [
          "c1"
        ]
      }
    ],
    "invariants": [
      "RESONANCE != EVIDENCE"
    ]
  },
  "logical_commitment": {
    "profile": "kristal.logical/jcs-sha256-v1",
    "digest": "sha256:109074caad15d7a96fbb77d84a89902e4df9d8293683d2eab45a685241ee9c3a"
  },
  "scope": {
    "workload": "polymorphic-reference"
  }
}
